[
  {
    "id": "placental_glucose.glucose_glut1_km_mmol_per_l",
    "name": "GLUT1 affinity for glucose",
    "subsystem": "placental_glucose",
    "value": {
      "central": 2.5,
      "low": 2.0,
      "high": 3.0,
      "units": "mmol/L",
      "distribution": "normal",
      "ci": 0.683
    },
    "tier": "B",
    "tier_rationale": "Tier B from Illsley 2000 Placenta review (PMID 10692246): GLUT1 is the primary syncytial transporter for trans-placental glucose; present on both microvillous and basal membranes with the basal acting as rate-limiting step. Km in the 2-5 mmol/L range is characteristic of the facilitated-diffusion family at physiological glucose.",
    "citations": [
      "illsley-2000-glut1"
    ],
    "primary_citation": "illsley-2000-glut1",
    "extraction": {
      "review_status": "unverified",
      "date": "2026-05-21",
      "reviewer": "metadata-and-abstract-audit"
    },
    "applicability": {
      "population": "Human term syncytiotrophoblast microvillous membrane vesicles"
    },
    "notes": "Michaelis constant for GLUT1-mediated glucose transport on the syncytiotrophoblast microvillous membrane."
  },
  {
    "id": "placental_glucose.glucose_glut1_vmax_per_area_mmol_per_min_per_m2",
    "name": "GLUT1 maximum transport rate per unit area",
    "subsystem": "placental_glucose",
    "value": {
      "central": 0.075,
      "low": 0.055,
      "high": 0.095,
      "units": "mmol/min/m^2"
    },
    "tier": "C",
    "tier_rationale": "Tier C from Illsley 2000 Placenta review: GLUT1 Vmax estimated from vesicle-protein-corrected microvillous-membrane data. Translation to per-area-of-villous-surface introduces extrapolation error.",
    "citations": [
      "illsley-2000-glut1"
    ],
    "primary_citation": "illsley-2000-glut1",
    "extraction": {
      "review_status": "unverified",
      "reviewer": "metadata-and-abstract-audit",
      "date": "2026-05-21"
    },
    "applicability": {
      "population": "Human term syncytiotrophoblast"
    },
    "notes": "Maximum facilitated-diffusion flux per unit villous surface area via GLUT1. Caveats: Vmax extrapolated from vesicle-protein assays scaled to whole-placenta villous surface area; tier C reflects the extrapolation."
  },
  {
    "id": "placental_glucose.glucose_glut3_km_mmol_per_l",
    "name": "GLUT3 affinity for glucose",
    "subsystem": "placental_glucose",
    "value": {
      "central": 1.5,
      "low": 1.2,
      "high": 1.8,
      "units": "mmol/L",
      "distribution": "normal",
      "ci": 0.683
    },
    "tier": "B",
    "tier_rationale": "Tier B from Baumann 2002 Endocrine review (PMID 12583599) summarising placental glucose-transporter kinetics. GLUT3 is the high-affinity isoform (Km ~1-2 mmol/L) and is localised to the syncytial microvillous membrane (confirmed by Brown 2011 PMID 22000473). The asymmetric GLUT distribution (microvillous >> basal) makes the basal membrane the rate-limiting step.",
    "citations": [
      "baumann-2002-glut3"
    ],
    "primary_citation": "baumann-2002-glut3",
    "extraction": {
      "review_status": "unverified",
      "date": "2026-05-21",
      "reviewer": "metadata-and-abstract-audit"
    },
    "applicability": {
      "population": "Human syncytiotrophoblast basal membrane"
    },
    "notes": "Michaelis constant for GLUT3-mediated glucose transport on the syncytiotrophoblast basal membrane."
  },
  {
    "id": "placental_glucose.glucose_glut3_vmax_per_area_mmol_per_min_per_m2",
    "name": "GLUT3 maximum transport rate per unit area",
    "subsystem": "placental_glucose",
    "value": {
      "central": 0.02,
      "low": 0.015,
      "high": 0.025,
      "units": "mmol/min/m^2"
    },
    "tier": "C",
    "tier_rationale": "Tier C: Vmax extrapolated from microvillous-membrane GLUT3 protein-expression data (Brown 2011 PMC3272879). Brown 2011 confirms GLUT3 is on the syncytiotrophoblast microvillous membrane and that expression declines through gestation (2nd trimester = 48±7% of 1st, 3rd trimester = 34±10% of 1st). Absolute Vmax inference from relative expression is the Tier-C step; the underlying expression data is robustly measured (n=8 per trimester, Western blot, siRNA-validated).",
    "citations": [
      "brown-2011-glut3"
    ],
    "primary_citation": "brown-2011-glut3",
    "extraction": {
      "review_status": "unverified",
      "date": "2026-05-21",
      "reviewer": "metadata-and-abstract-audit"
    },
    "applicability": {
      "population": "Human syncytiotrophoblast across gestation"
    },
    "notes": "Maximum facilitated-diffusion flux per unit villous surface area via GLUT3. Caveats: GLUT3 expression rises through gestation; this is a term-equivalent reference value."
  }
]
